domain,gut_id,title,authors,languages,downloads,subjects,preferred_source,preferred_url,gutenberg_epub_url
literature_core,52521,Grimm's Fairy Tales,"Grimm, Jacob, Grimm, Wilhelm",en,2754,"Children's stories, German -- Translations into English; Fairy tales; Fairy tales -- Germany",gutenberg,https://www.gutenberg.org/ebooks/52521.epub3.images,https://www.gutenberg.org/ebooks/52521.epub3.images
literature_core,47677,"Ars Amatoria; or, The Art Of Love: Literally Translated into English Prose, with Copious Notes",Ovid,en,2685,Latin poetry -- Adaptations; Latin poetry -- Translations into English,gutenberg,https://www.gutenberg.org/ebooks/47677.epub3.images,https://www.gutenberg.org/ebooks/47677.epub3.images
literature_core,70854,The Countess of Pembroke's Arcadia,"Sidney, Philip",en,2684,"Pastoral literature, English",gutenberg,https://www.gutenberg.org/ebooks/70854.epub3.images,https://www.gutenberg.org/ebooks/70854.epub3.images
literature_core,963,Little Dorrit,"Dickens, Charles",en,2675,"Children of prisoners -- Fiction; Debt, Imprisonment for -- Fiction; Domestic fiction; Fathers and daughters -- Fiction; Inheritance and succession -- Fiction; London (England) -- Fiction; Love stories; Marshalsea Prison (Southwark, London, England) -- Fiction",standardebooks,https://standardebooks.org/ebooks/charles-dickens/little-dorrit/downloads/charles-dickens_little-dorrit.epub?source=feed,https://www.gutenberg.org/ebooks/963.epub3.images
literature_core,42166,The Poems of Sappho: An Interpretative Rendition into English,Sappho,en,2672,Lesbos (Greece : Municipality) -- Poetry; Sappho -- Translations into English; Women -- Greece -- Poetry,gutenberg,https://www.gutenberg.org/ebooks/42166.epub3.images,https://www.gutenberg.org/ebooks/42166.epub3.images
literature_core,3186,"The Mysterious Stranger, and Other Stories","Twain, Mark",en,2662,"Humorous stories, American; Short stories; United States -- Social life and customs -- 19th century -- Fiction",gutenberg,https://www.gutenberg.org/ebooks/3186.epub3.images,https://www.gutenberg.org/ebooks/3186.epub3.images
literature_core,1237,Father Goriot,"Balzac, Honoré de",en,2658,"Fathers and daughters -- Fiction; France -- History -- Louis XVIII, 1814-1824 -- Fiction; French fiction -- Translations into English; Older men -- Fiction; Paris (France) -- Fiction",standardebooks,https://standardebooks.org/ebooks/honore-de-balzac/father-goriot/ellen-marriage/downloads/honore-de-balzac_father-goriot_ellen-marriage.epub?source=feed,https://www.gutenberg.org/ebooks/1237.epub3.images
literature_core,77,The House of the Seven Gables,"Hawthorne, Nathaniel",en,2600,Domestic fiction; Haunted houses -- Fiction; Historical fiction; Paranormal fiction; Salem (Mass.) -- Fiction,standardebooks,https://standardebooks.org/ebooks/nathaniel-hawthorne/the-house-of-the-seven-gables/downloads/nathaniel-hawthorne_the-house-of-the-seven-gables.epub?source=feed,https://www.gutenberg.org/ebooks/77.epub3.images
literature_core,31,Plays of Sophocles: Oedipus the King; Oedipus at Colonus; Antigone,Sophocles,en,2537,Antigone (Mythological character) -- Drama; Greek drama (Tragedy) -- Translations into English; Oedipus (Greek mythological figure) -- Drama; Tragedies (Drama),gutenberg,https://www.gutenberg.org/ebooks/31.epub3.images,https://www.gutenberg.org/ebooks/31.epub3.images
literature_core,39270,"The life and opinions of Tristram Shandy, gentleman","Sterne, Laurence",en,2507,Experimental fiction; Fetus -- Fiction; Fiction -- Authorship -- Fiction; Infants -- Fiction; Stream of consciousness fiction,gutenberg,https://www.gutenberg.org/ebooks/39270.epub3.images,https://www.gutenberg.org/ebooks/39270.epub3.images
literature_core,70731,A history of English literature : $b A practical text-book,"Albert, Edward",en,2495,English literature -- History and criticism,gutenberg,https://www.gutenberg.org/ebooks/70731.epub3.images,https://www.gutenberg.org/ebooks/70731.epub3.images
literature_core,50316,The Fables of La Fontaine: Translated into English Verse by Walter Thornbury and Illustrated by Gustave Doré,"La Fontaine, Jean de",en,2493,"Fables, French -- Translations into English",gutenberg,https://www.gutenberg.org/ebooks/50316.epub3.images,https://www.gutenberg.org/ebooks/50316.epub3.images
literature_core,17957,On the Sublime,"Longinus, active 1st century",en,2486,"Rhetoric, Ancient; Sublime, The",gutenberg,https://www.gutenberg.org/ebooks/17957.epub3.images,https://www.gutenberg.org/ebooks/17957.epub3.images
literature_core,28,"The Fables of Aesop: Selected, Told Anew, and Their History Traced",Aesop,en,2466,"Aesop's fables -- Adaptations; Fables, Greek -- Adaptations",gutenberg,https://www.gutenberg.org/ebooks/28.epub3.images,https://www.gutenberg.org/ebooks/28.epub3.images
literature_core,47960,Romeo and Juliet,"Shakespeare, William",en,2453,Conflict of generations -- Drama; Juliet (Fictitious character) -- Drama; Romeo (Fictitious character) -- Drama; Tragedies (Drama); Vendetta -- Drama; Verona (Italy) -- Drama; Youth -- Drama,gutenberg,https://www.gutenberg.org/ebooks/47960.epub3.images,https://www.gutenberg.org/ebooks/47960.epub3.images
literature_core,1564,"Boswell's Life of Johnson: Abridged and edited, with an introduction by Charles Grosvenor Osgood","Boswell, James",en,2445,"Authors, English -- 18th century -- Biography; Critics -- Great Britain -- Biography; Johnson, Samuel, 1709-1784; Lexicographers -- Great Britain -- Biography",gutenberg,https://www.gutenberg.org/ebooks/1564.epub3.images,https://www.gutenberg.org/ebooks/1564.epub3.images
literature_core,217,Sons and Lovers,"Lawrence, D. H. (David Herbert)",en,2424,Autobiographical fiction; Bildungsromans; Domestic fiction; England -- Fiction; Working class families -- Fiction; Young men -- Fiction,gutenberg,https://www.gutenberg.org/ebooks/217.epub3.images,https://www.gutenberg.org/ebooks/217.epub3.images
literature_core,821,Dombey and Son,"Dickens, Charles",en,2334,Businesspeople -- Fiction; Domestic fiction; Dysfunctional families -- Fiction; England -- Fiction; Family-owned business enterprises -- Fiction; Fathers and daughters -- Fiction,gutenberg,https://www.gutenberg.org/ebooks/821.epub3.images,https://www.gutenberg.org/ebooks/821.epub3.images
literature_core,39452,The Pilgrim's Progress by John Bunyan Every Child Can Read,"Bunyan, John",en,2324,Christian life -- Juvenile literature; Christian pilgrims and pilgrimages -- Juvenile literature,gutenberg,https://www.gutenberg.org/ebooks/39452.epub3.images,https://www.gutenberg.org/ebooks/39452.epub3.images
literature_core,34117,Beowulf: An Introduction to the Study of the Poem with a Discussion of the Stories of Offa and Finn,"Chambers, R. W. (Raymond Wilson)",en,2315,"Anglo-Saxons -- Kings and rulers; Beowulf; Dragons in literature; Epic poetry, English (Old) -- History and criticism; Fight at Finnesburg (Anglo-Saxon poem); Heroes in literature; Mercia (Kingdom) -- In literature; Monsters in literature; Offa saga; Offa, King of the Mercians, -796 -- In literature",gutenberg,https://www.gutenberg.org/ebooks/34117.epub3.images,https://www.gutenberg.org/ebooks/34117.epub3.images
literature_core,14417,The Agamemnon of Aeschylus: Translated into English Rhyming Verse with Explanatory Notes,Aeschylus,en,2307,"Agamemnon, King of Mycenae (Mythological character) -- Drama",gutenberg,https://www.gutenberg.org/ebooks/14417.epub3.images,https://www.gutenberg.org/ebooks/14417.epub3.images
literature_core,1321,The Waste Land,"Eliot, T. S. (Thomas Stearns)",en,2306,Poetry; Prose poems,gutenberg,https://www.gutenberg.org/ebooks/1321.epub3.images,https://www.gutenberg.org/ebooks/1321.epub3.images
literature_core,1643,Meno,Plato,en,2271,"Classical literature; Ethics -- Early works to 1800; Socrates, 470 BC-399 BC; Virtue -- Early works to 1800",gutenberg,https://www.gutenberg.org/ebooks/1643.epub3.images,https://www.gutenberg.org/ebooks/1643.epub3.images
literature_core,75170,The sound and the fury,"Faulkner, William",en,2268,African American women cooks -- Fiction; Aristocracy (Social class) -- Fiction; Domestic fiction; Illegitimate children -- Fiction; Mississippi -- Fiction; People with mental disabilities -- Fiction; Psychological fiction; Siblings -- Fiction,gutenberg,https://www.gutenberg.org/ebooks/75170.epub3.images,https://www.gutenberg.org/ebooks/75170.epub3.images
literature_core,1519,Much Ado about Nothing,"Shakespeare, William",en,2267,Comedy plays; Conspiracies -- Drama; Courtship -- Drama; Messina (Italy) -- Drama; Rejection (Psychology) -- Drama,gutenberg,https://www.gutenberg.org/ebooks/1519.epub3.images,https://www.gutenberg.org/ebooks/1519.epub3.images
literature_core,53489,"The Life of Lazarillo de Tormes: His Fortunes & Adversities; with a Notice of the Mendoza Family, a Short Life of the Author, Don Diego Hurtado De Mendoza, a Notice of the Work, and Some Remarks on the Character of Lazarillo de Tormes",Anonymous,en,2255,Picaresque fiction; Spanish fiction -- Translations into English,gutenberg,https://www.gutenberg.org/ebooks/53489.epub3.images,https://www.gutenberg.org/ebooks/53489.epub3.images
literature_core,1591,Protagoras,Plato,en,2253,"Classical literature; Protagoras; Socrates, 470 BC-399 BC; Sophists (Greek philosophy); Virtue -- Early works to 1800",gutenberg,https://www.gutenberg.org/ebooks/1591.epub3.images,https://www.gutenberg.org/ebooks/1591.epub3.images
literature_core,11000,An Old Babylonian Version of the Gilgamesh Epic,"Jastrow, Morris, Clay, Albert Tobias",en,2247,"Epic poetry, Assyro-Babylonian",gutenberg,https://www.gutenberg.org/ebooks/11000.epub3.images,https://www.gutenberg.org/ebooks/11000.epub3.images
literature_core,325,Phantastes: A Faerie Romance for Men and Women,"MacDonald, George",en,2243,Fantasy fiction,gutenberg,https://www.gutenberg.org/ebooks/325.epub3.images,https://www.gutenberg.org/ebooks/325.epub3.images
literature_core,33858,The Adventurous Simplicissimus: being the description of the Life of a Strange vagabond named Melchior Sternfels von Fuchshaim,"Grimmelshausen, Hans Jakob Christoph von",en,2214,"German fiction -- Translations into English; Thirty Years' War, 1618-1648 -- Fiction",gutenberg,https://www.gutenberg.org/ebooks/33858.epub3.images,https://www.gutenberg.org/ebooks/33858.epub3.images
literature_core,2226,Kim,"Kipling, Rudyard",en,2194,Adventure stories; Boys -- Fiction; India -- Fiction; Irish -- India -- Fiction; Lamas -- Fiction; Orphans -- Fiction; Spy stories,standardebooks,https://standardebooks.org/ebooks/rudyard-kipling/kim/downloads/rudyard-kipling_kim.epub?source=feed,https://www.gutenberg.org/ebooks/2226.epub3.images
literature_core,1531,Othello,"Shakespeare, William",en,2192,Interracial marriage -- Drama; Jealousy -- Drama; Muslims -- Drama; Othello (Fictitious character) -- Drama; Tragedies (Drama); Venice (Italy) -- Drama,standardebooks,https://standardebooks.org/ebooks/william-shakespeare/othello/downloads/william-shakespeare_othello.epub?source=feed,https://www.gutenberg.org/ebooks/1531.epub3.images
literature_core,35451,Medea of Euripides,Euripides,en,2186,"Medea, consort of Aegeus, King of Athens (Mythological character) -- Drama",gutenberg,https://www.gutenberg.org/ebooks/35451.epub3.images,https://www.gutenberg.org/ebooks/35451.epub3.images
literature_core,29021,The Fairy Tales of Charles Perrault,"Perrault, Charles",en,2183,Fairy tales,gutenberg,https://www.gutenberg.org/ebooks/29021.epub3.images,https://www.gutenberg.org/ebooks/29021.epub3.images
literature_core,35173,The Bacchae of Euripides,Euripides,en,2155,"Bacchantes -- Drama; Dionysus (Greek deity) -- Drama; Pentheus, King of Thebes (Mythological character) -- Drama",gutenberg,https://www.gutenberg.org/ebooks/35173.epub3.images,https://www.gutenberg.org/ebooks/35173.epub3.images
literature_core,26073,"The Metamorphoses of Ovid, Books VIII-XV",Ovid,en,2147,"Classical literature; Fables, Latin -- Translations into English; Latin poetry -- Translations into English; Metamorphosis -- Mythology -- Poetry; Mythology, Classical -- Poetry",gutenberg,https://www.gutenberg.org/ebooks/26073.epub3.images,https://www.gutenberg.org/ebooks/26073.epub3.images
literature_core,33,The Scarlet Letter,"Hawthorne, Nathaniel",en,2147,"Adultery -- Fiction; Boston (Mass.) -- History -- Colonial period, ca. 1600-1775 -- Fiction; Clergy -- Fiction; Historical fiction; Illegitimate children -- Fiction; Married women -- Fiction; Psychological fiction; Puritans -- Fiction; Revenge -- Fiction; Triangles (Interpersonal relations) -- Fiction; Women immigrants -- Fiction",standardebooks,https://standardebooks.org/ebooks/nathaniel-hawthorne/the-scarlet-letter/downloads/nathaniel-hawthorne_the-scarlet-letter.epub?source=feed,https://www.gutenberg.org/ebooks/33.epub3.images
literature_core,1571,Critias,Plato,en,2143,Classical literature,gutenberg,https://www.gutenberg.org/ebooks/1571.epub3.images,https://www.gutenberg.org/ebooks/1571.epub3.images
literature_core,63203,Faust: A Tragedy,"Goethe, Johann Wolfgang von",en,2108,"Faust, -approximately 1540 -- Drama; Tragedies (Drama)",gutenberg,https://www.gutenberg.org/ebooks/63203.epub3.images,https://www.gutenberg.org/ebooks/63203.epub3.images
literature_core,56075,"Seneca's Morals of a Happy Life, Benefits, Anger and Clemency","Seneca, Lucius Annaeus",en,2101,Conduct of life; Ethics,gutenberg,https://www.gutenberg.org/ebooks/56075.epub3.images,https://www.gutenberg.org/ebooks/56075.epub3.images
literature_core,49103,The First Printed Translations into English of the Great Foreign Classics: A Supplement to Text-Books of English Literature,"Harris, William James",en,2076,Literature -- Translations into English -- Bibliography,gutenberg,https://www.gutenberg.org/ebooks/49103.epub3.images,https://www.gutenberg.org/ebooks/49103.epub3.images
literature_core,22049,"A Literary History of the English People, from the Origins to the Renaissance","Jusserand, J. J. (Jean Jules)",en,2038,English literature -- History and criticism,gutenberg,https://www.gutenberg.org/ebooks/22049.epub3.images,https://www.gutenberg.org/ebooks/22049.epub3.images
literature_core,5160,The Mabinogion,Unknown,en,2014,"Mythology, Celtic -- Wales; Tales -- Wales; Welsh literature -- 1100-1400 -- Translations into English",gutenberg,https://www.gutenberg.org/ebooks/5160.epub3.images,https://www.gutenberg.org/ebooks/5160.epub3.images
literature_core,1065,The Raven,"Poe, Edgar Allan",en,2010,"Fantasy poetry, American; Ravens -- Poetry",gutenberg,https://www.gutenberg.org/ebooks/1065.epub3.images,https://www.gutenberg.org/ebooks/1065.epub3.images
literature_core,30235,Six Centuries of English Poetry: Tennyson to Chaucer,"Baldwin, James",en,1998,English poetry,gutenberg,https://www.gutenberg.org/ebooks/30235.epub3.images,https://www.gutenberg.org/ebooks/30235.epub3.images
literature_core,1004,"Divine Comedy, Longfellow's Translation, Complete",Dante Alighieri,en,1988,"Epic poetry, Italian -- Translations into English; Italian poetry -- To 1400 -- Translations into English",gutenberg,https://www.gutenberg.org/ebooks/1004.epub3.images,https://www.gutenberg.org/ebooks/1004.epub3.images
literature_core,3200,The Entire Project Gutenberg Works of Mark Twain,"Twain, Mark",en,1987,American literature -- 19th century; Literature -- Collections,gutenberg,https://www.gutenberg.org/ebooks/3200.epub3.images,https://www.gutenberg.org/ebooks/3200.epub3.images
literature_core,41085,The New Life (La Vita Nuova),Dante Alighieri,en,1972,Italian literature -- Translations into English,gutenberg,https://www.gutenberg.org/ebooks/41085.epub3.images,https://www.gutenberg.org/ebooks/41085.epub3.images
literature_core,8789,"The vision of hell.: By Dante Alighieri.; Translated by Rev. Henry Francis Cary, M.A.; and illustrated with the seventy-five designs of Gustave Doré.",Dante Alighieri,en,1972,"Epic poetry, Italian -- Translations into English; Hell -- Poetry; Italian poetry -- To 1400 -- Translations into English",gutenberg,https://www.gutenberg.org/ebooks/8789.epub3.images,https://www.gutenberg.org/ebooks/8789.epub3.images
literature_core,1635,Ion,Plato,en,1959,"Aesthetics, Ancient; Classical literature; Homer. Iliad; Poetics -- History -- To 1500",gutenberg,https://www.gutenberg.org/ebooks/1635.epub3.images,https://www.gutenberg.org/ebooks/1635.epub3.images
literature_core,28885,Alice's Adventures in Wonderland: Illustrated by Arthur Rackham. With a Proem by Austin Dobson,"Carroll, Lewis",en,1952,Alice (Fictitious character from Carroll) -- Juvenile fiction; Children's stories; Fantasy fiction; Imaginary places -- Juvenile fiction,gutenberg,https://www.gutenberg.org/ebooks/28885.epub3.images,https://www.gutenberg.org/ebooks/28885.epub3.images
literature_core,19337,A Christmas Carol,"Dickens, Charles",en,1933,"Christmas stories; Ghost stories; London (England) -- Fiction; Misers -- Fiction; Poor families -- Fiction; Scrooge, Ebenezer (Fictitious character) -- Fiction; Sick children -- Fiction",standardebooks,https://standardebooks.org/ebooks/charles-dickens/a-christmas-carol/downloads/charles-dickens_a-christmas-carol.epub?source=feed,https://www.gutenberg.org/ebooks/19337.epub3.images
literature_core,16452,The Iliad of Homer: Translated into English Blank Verse by William Cowper,Homer,en,1918,"Achilles (Mythological character) -- Poetry; Epic poetry, Greek -- Translations into English; Trojan War -- Poetry",gutenberg,https://www.gutenberg.org/ebooks/16452.epub3.images,https://www.gutenberg.org/ebooks/16452.epub3.images
literature_core,2992,The Middle-Class Gentleman,Molière,en,1913,Comedy plays; France -- Social life and customs -- 17th century -- Drama; French drama; Middle class -- France -- Drama,gutenberg,https://www.gutenberg.org/ebooks/2992.epub3.images,https://www.gutenberg.org/ebooks/2992.epub3.images
literature_core,1508,The Taming of the Shrew,"Shakespeare, William",en,1875,Comedy plays; Man-woman relationships -- Drama; Married people -- Drama; Padua (Italy) -- Drama; Sex role -- Drama,standardebooks,https://standardebooks.org/ebooks/william-shakespeare/the-taming-of-the-shrew/downloads/william-shakespeare_the-taming-of-the-shrew.epub?source=feed,https://www.gutenberg.org/ebooks/1508.epub3.images
literature_core,47676,"The Amores; or, Amours: Literally Translated into English Prose, with Copious Notes",Ovid,en,1871,Latin poetry -- Adaptations; Latin poetry -- Translations into English,gutenberg,https://www.gutenberg.org/ebooks/47676.epub3.images,https://www.gutenberg.org/ebooks/47676.epub3.images
literature_core,24269,The Odyssey of Homer,Homer,en,1867,"Epic poetry, Greek -- Translations into English; Homer -- Translations into English; Odysseus, King of Ithaca (Mythological character) -- Poetry",standardebooks,https://standardebooks.org/ebooks/homer/the-odyssey/william-cullen-bryant/downloads/homer_the-odyssey_william-cullen-bryant.epub?source=feed,https://www.gutenberg.org/ebooks/24269.epub3.images
literature_core,49324,"The Authoress of the Odyssey: Where and when she wrote, who she was, the use she made of the Iliad, and how the poem grew under her hands","Butler, Samuel",en,1862,"Epic poetry, Greek -- Authorship; Homer. Odyssey -- Authorship; Odysseus, King of Ithaca (Mythological character) -- In literature; Women and literature -- Greece",gutenberg,https://www.gutenberg.org/ebooks/49324.epub3.images,https://www.gutenberg.org/ebooks/49324.epub3.images
literature_core,48895,"The Odysseys of Homer, together with the shorter poems",Homer,en,1856,"Epic poetry, Greek -- Translations into English; Odysseus, King of Ithaca (Mythological character) -- Poetry",gutenberg,https://www.gutenberg.org/ebooks/48895.epub3.images,https://www.gutenberg.org/ebooks/48895.epub3.images
literature_core,151,The Rime of the Ancient Mariner,"Coleridge, Samuel Taylor",en,1852,Poetry,gutenberg,https://www.gutenberg.org/ebooks/151.epub3.images,https://www.gutenberg.org/ebooks/151.epub3.images
literature_core,10607,The Real Mother Goose,Unknown,en,1851,Children's poetry; Nursery rhymes,gutenberg,https://www.gutenberg.org/ebooks/10607.epub3.images,https://www.gutenberg.org/ebooks/10607.epub3.images
literature_core,18897,The Epic of Gilgamish: A Fragment of the Gilgamish Legend in Old-Babylonian Cuneiform,"Langdon, Stephen",en,1847,"Epic poetry, Assyro-Babylonian -- Translations into English",gutenberg,https://www.gutenberg.org/ebooks/18897.epub3.images,https://www.gutenberg.org/ebooks/18897.epub3.images
literature_core,3735,The Inspector-General,"Gogol, Nikolai Vasilevich",en,1831,Comedy plays; Russia -- Social life and customs -- Drama; Russian drama -- Translations into English,gutenberg,https://www.gutenberg.org/ebooks/3735.epub3.images,https://www.gutenberg.org/ebooks/3735.epub3.images
literature_core,652,"Rasselas, Prince of Abyssinia","Johnson, Samuel",en,1821,Ethiopia -- Fiction; Happiness -- Fiction; Princes -- Fiction; Satire,gutenberg,https://www.gutenberg.org/ebooks/652.epub3.images,https://www.gutenberg.org/ebooks/652.epub3.images
literature_core,7100,"Adventures of Huckleberry Finn, Chapters 01 to 05","Twain, Mark",en,1814,"Adventure stories; Bildungsromans; Boys -- Fiction; Finn, Huckleberry (Fictitious character) -- Fiction; Fugitive slaves -- Fiction; Humorous stories; Male friendship -- Fiction; Mississippi River -- Fiction; Missouri -- Fiction; Race relations -- Fiction; Runaway children -- Fiction",gutenberg,https://www.gutenberg.org/ebooks/7100.epub3.images,https://www.gutenberg.org/ebooks/7100.epub3.images
literature_core,143,The Mayor of Casterbridge,"Hardy, Thomas",en,1807,Atonement -- Fiction; Fathers and daughters -- Fiction; Mayors -- Fiction; Men -- England -- Fiction; Psychological fiction; Runaway husbands -- Fiction; Wessex (England) -- Fiction,standardebooks,https://standardebooks.org/ebooks/thomas-hardy/the-mayor-of-casterbridge/downloads/thomas-hardy_the-mayor-of-casterbridge.epub?source=feed,https://www.gutenberg.org/ebooks/143.epub3.images
literature_core,3330,The Analects of Confucius (from the Chinese Classics),Confucius,en,1787,"Ethics -- China; Philosophy, Chinese",gutenberg,https://www.gutenberg.org/ebooks/3330.epub3.images,https://www.gutenberg.org/ebooks/3330.epub3.images
literature_core,19481,"""Everyman,"" with other interludes, including eight miracle plays",Unknown,en,1783,"Bible plays, English; English drama -- To 1500; Moralities, English; Mysteries and miracle-plays, English",gutenberg,https://www.gutenberg.org/ebooks/19481.epub3.images,https://www.gutenberg.org/ebooks/19481.epub3.images
literature_core,1365,The Complete Poetical Works of Henry Wadsworth Longfellow,"Longfellow, Henry Wadsworth",en,1773,American poetry,gutenberg,https://www.gutenberg.org/ebooks/1365.epub3.images,https://www.gutenberg.org/ebooks/1365.epub3.images
literature_core,59784,Index of the Project Gutenberg Works of Marcus Aurelius Antoninus,"Marcus Aurelius, Emperor of Rome",en,1767,Indexes,gutenberg,https://www.gutenberg.org/ebooks/59784.epub3.images,https://www.gutenberg.org/ebooks/59784.epub3.images
literature_core,968,Martin Chuzzlewit,"Dickens, Charles",en,1763,Adventure stories; Avarice -- Fiction; Bildungsromans; Black humor; British -- United States -- Fiction; England -- Fiction; Grandfathers -- Fiction; Satire; United States -- Description and travel -- Fiction; Young men -- Fiction,standardebooks,https://standardebooks.org/ebooks/charles-dickens/martin-chuzzlewit/downloads/charles-dickens_martin-chuzzlewit.epub?source=feed,https://www.gutenberg.org/ebooks/968.epub3.images
literature_core,1728,The Odyssey of Homer,Homer,en,1734,"Epic poetry, Greek -- Translations into English; Homer -- Translations into English; Odysseus, King of Ithaca (Mythological character)",standardebooks,https://standardebooks.org/ebooks/homer/the-odyssey/william-cullen-bryant/downloads/homer_the-odyssey_william-cullen-bryant.epub?source=feed,https://www.gutenberg.org/ebooks/1728.epub3.images
literature_core,9842,Y Gododin: A Poem of the Battle of Cattraeth,Aneirin,"cy,en",1691,"Cattraeth, Battle of, Catterick, England, ca. 600 -- Poetry",gutenberg,https://www.gutenberg.org/ebooks/9842.epub3.images,https://www.gutenberg.org/ebooks/9842.epub3.images
literature_core,57999,"The Tragedies of Seneca: Translated into English Verse, to Which Have Been Appended Comparative Analyses of the Corresponding Greek and Roman Plays, and a Mythological Index","Seneca, Lucius Annaeus",en,1637,"Mythology, Classical -- Drama; Seneca, Lucius Annaeus, approximately 4 B.C.-65 A.D. -- Translations into English",gutenberg,https://www.gutenberg.org/ebooks/57999.epub3.images,https://www.gutenberg.org/ebooks/57999.epub3.images
literature_core,28621,The Metamorphoses of Publius Ovidus Naso in English blank verse Vols. I & II,Ovid,en,1633,"Classical literature; Fables, Latin -- Translations into English; Latin poetry -- Translations into English; Metamorphosis -- Mythology -- Poetry; Mythology, Classical -- Poetry",gutenberg,https://www.gutenberg.org/ebooks/28621.epub3.images,https://www.gutenberg.org/ebooks/28621.epub3.images
literature_core,792,"Wieland; Or, The Transformation: An American Tale","Brown, Charles Brockden",en,1599,"Combustion, Spontaneous -- Fiction; Epistolary fiction; Fathers -- Death -- Fiction; Gothic fiction; Horror tales; Pennsylvania -- History -- Colonial period, ca. 1600-1775 -- Fiction; Psychological fiction; Radicals -- Fiction; Religious fanaticism -- Fiction; Siblings -- Fiction",gutenberg,https://www.gutenberg.org/ebooks/792.epub3.images,https://www.gutenberg.org/ebooks/792.epub3.images
literature_core,2267,Othello,"Shakespeare, William",en,1539,Interracial marriage -- Drama; Jealousy -- Drama; Muslims -- Drama; Othello (Fictitious character) -- Drama; Tragedies (Drama); Venice (Italy) -- Drama,standardebooks,https://standardebooks.org/ebooks/william-shakespeare/othello/downloads/william-shakespeare_othello.epub?source=feed,https://www.gutenberg.org/ebooks/2267.epub3.images
